{
  "schema_version": 1,
  "id": "sun",
  "name": "Sun",
  "name_i18n": "pathway.sun",
  "group": "god_almighty",
  "god_title": "Sun",
  "from_outer_deity": false,
  "gameplay_verb": "Purificare, benedire e ridurre la Sequenza dei nemici",
  "tags": [
    "luce",
    "purificazione",
    "contratto",
    "fuoco"
  ],
  "sequences": [
    {
      "sequence": 9,
      "id": "sun_9",
      "name": "Bard",
      "name_i18n": "sequence.sun.9",
      "tier": "low",
      "concept": "",
      "stat_modifiers": {},
      "abilities": [],
      "acting_actions": [],
      "potion": {
        "characteristic_sequence": 9,
        "ingredients": [],
        "formula_id": "formula_sun_9"
      },
      "advancement_ritual": null,
      "madness_on_force": 0,
      "notes": ""
    },
    {
      "sequence": 8,
      "id": "sun_8",
      "name": "Light Supplicant",
      "name_i18n": "sequence.sun.8",
      "tier": "low",
      "concept": "",
      "stat_modifiers": {},
      "abilities": [],
      "acting_actions": [],
      "potion": {
        "characteristic_sequence": 8,
        "ingredients": [],
        "formula_id": "formula_sun_8"
      },
      "advancement_ritual": null,
      "madness_on_force": 0,
      "notes": ""
    },
    {
      "sequence": 7,
      "id": "sun_7",
      "name": "Solar High Priest",
      "name_i18n": "sequence.sun.7",
      "tier": "low",
      "concept": "",
      "stat_modifiers": {},
      "abilities": [],
      "acting_actions": [],
      "potion": {
        "characteristic_sequence": 7,
        "ingredients": [],
        "formula_id": "formula_sun_7"
      },
      "advancement_ritual": null,
      "madness_on_force": 0,
      "notes": ""
    },
    {
      "sequence": 6,
      "id": "sun_6",
      "name": "Notary",
      "name_i18n": "sequence.sun.6",
      "tier": "mid",
      "concept": "",
      "stat_modifiers": {},
      "abilities": [],
      "acting_actions": [],
      "potion": {
        "characteristic_sequence": 6,
        "ingredients": [],
        "formula_id": "formula_sun_6"
      },
      "advancement_ritual": null,
      "madness_on_force": 0,
      "notes": ""
    },
    {
      "sequence": 5,
      "id": "sun_5",
      "name": "Priest of Light",
      "name_i18n": "sequence.sun.5",
      "tier": "mid",
      "concept": "",
      "stat_modifiers": {},
      "abilities": [],
      "acting_actions": [],
      "potion": {
        "characteristic_sequence": 5,
        "ingredients": [],
        "formula_id": "formula_sun_5"
      },
      "advancement_ritual": null,
      "madness_on_force": 0,
      "notes": ""
    },
    {
      "sequence": 4,
      "id": "sun_4",
      "name": "Unshadowed",
      "name_i18n": "sequence.sun.4",
      "tier": "saint",
      "concept": "",
      "stat_modifiers": {},
      "abilities": [],
      "acting_actions": [],
      "potion": {
        "characteristic_sequence": 4,
        "ingredients": [],
        "formula_id": "formula_sun_4"
      },
      "advancement_ritual": {
        "location_tags": [],
        "moon_phase": null,
        "sacrifices": [],
        "sigils": []
      },
      "madness_on_force": 0,
      "notes": ""
    },
    {
      "sequence": 3,
      "id": "sun_3",
      "name": "Justice Mentor",
      "name_i18n": "sequence.sun.3",
      "tier": "saint",
      "concept": "",
      "stat_modifiers": {},
      "abilities": [],
      "acting_actions": [],
      "potion": {
        "characteristic_sequence": 3,
        "ingredients": [],
        "formula_id": "formula_sun_3"
      },
      "advancement_ritual": {
        "location_tags": [],
        "moon_phase": null,
        "sacrifices": [],
        "sigils": []
      },
      "madness_on_force": 0,
      "notes": ""
    },
    {
      "sequence": 2,
      "id": "sun_2",
      "name": "Lightseeker",
      "name_i18n": "sequence.sun.2",
      "tier": "angel",
      "concept": "",
      "stat_modifiers": {},
      "abilities": [],
      "acting_actions": [],
      "potion": {
        "characteristic_sequence": 2,
        "ingredients": [],
        "formula_id": "formula_sun_2"
      },
      "advancement_ritual": {
        "location_tags": [],
        "moon_phase": null,
        "sacrifices": [],
        "sigils": []
      },
      "madness_on_force": 0,
      "notes": ""
    },
    {
      "sequence": 1,
      "id": "sun_1",
      "name": "White Angel",
      "name_i18n": "sequence.sun.1",
      "tier": "angel",
      "concept": "",
      "stat_modifiers": {},
      "abilities": [],
      "acting_actions": [],
      "potion": {
        "characteristic_sequence": 1,
        "ingredients": [],
        "formula_id": "formula_sun_1"
      },
      "advancement_ritual": {
        "location_tags": [],
        "moon_phase": null,
        "sacrifices": [],
        "sigils": []
      },
      "madness_on_force": 0,
      "notes": ""
    },
    {
      "sequence": 0,
      "id": "sun_0",
      "name": "Sun",
      "name_i18n": "sequence.sun.0",
      "tier": "god",
      "concept": "",
      "stat_modifiers": {},
      "abilities": [],
      "acting_actions": [],
      "potion": {
        "characteristic_sequence": 0,
        "ingredients": [],
        "formula_id": "formula_sun_0"
      },
      "advancement_ritual": {
        "location_tags": [],
        "moon_phase": null,
        "sacrifices": [],
        "sigils": []
      },
      "madness_on_force": 0,
      "notes": ""
    }
  ]
}
