{
  "schema_version": 1,
  "id": "black_emperor",
  "name": "Black Emperor",
  "name_i18n": "pathway.black_emperor",
  "group": "the_anarchy",
  "god_title": "Black Emperor",
  "from_outer_deity": true,
  "gameplay_verb": "Corrompere e distorcere le regole del gioco stesso",
  "tags": [
    "disordine",
    "corruzione",
    "cavillo",
    "dominio"
  ],
  "sequences": [
    {
      "sequence": 9,
      "id": "black_emperor_9",
      "name": "Lawyer",
      "name_i18n": "sequence.black_emperor.9",
      "tier": "low",
      "concept": "",
      "stat_modifiers": {},
      "abilities": [],
      "acting_actions": [],
      "potion": {
        "characteristic_sequence": 9,
        "ingredients": [],
        "formula_id": "formula_black_emperor_9"
      },
      "advancement_ritual": null,
      "madness_on_force": 0,
      "notes": ""
    },
    {
      "sequence": 8,
      "id": "black_emperor_8",
      "name": "Barbarian",
      "name_i18n": "sequence.black_emperor.8",
      "tier": "low",
      "concept": "",
      "stat_modifiers": {},
      "abilities": [],
      "acting_actions": [],
      "potion": {
        "characteristic_sequence": 8,
        "ingredients": [],
        "formula_id": "formula_black_emperor_8"
      },
      "advancement_ritual": null,
      "madness_on_force": 0,
      "notes": ""
    },
    {
      "sequence": 7,
      "id": "black_emperor_7",
      "name": "Briber",
      "name_i18n": "sequence.black_emperor.7",
      "tier": "low",
      "concept": "",
      "stat_modifiers": {},
      "abilities": [],
      "acting_actions": [],
      "potion": {
        "characteristic_sequence": 7,
        "ingredients": [],
        "formula_id": "formula_black_emperor_7"
      },
      "advancement_ritual": null,
      "madness_on_force": 0,
      "notes": ""
    },
    {
      "sequence": 6,
      "id": "black_emperor_6",
      "name": "Baron of Corruption",
      "name_i18n": "sequence.black_emperor.6",
      "tier": "mid",
      "concept": "",
      "stat_modifiers": {},
      "abilities": [],
      "acting_actions": [],
      "potion": {
        "characteristic_sequence": 6,
        "ingredients": [],
        "formula_id": "formula_black_emperor_6"
      },
      "advancement_ritual": null,
      "madness_on_force": 0,
      "notes": ""
    },
    {
      "sequence": 5,
      "id": "black_emperor_5",
      "name": "Mentor of Disorder",
      "name_i18n": "sequence.black_emperor.5",
      "tier": "mid",
      "concept": "",
      "stat_modifiers": {},
      "abilities": [],
      "acting_actions": [],
      "potion": {
        "characteristic_sequence": 5,
        "ingredients": [],
        "formula_id": "formula_black_emperor_5"
      },
      "advancement_ritual": null,
      "madness_on_force": 0,
      "notes": ""
    },
    {
      "sequence": 4,
      "id": "black_emperor_4",
      "name": "Earl of the Fallen",
      "name_i18n": "sequence.black_emperor.4",
      "tier": "saint",
      "concept": "",
      "stat_modifiers": {},
      "abilities": [],
      "acting_actions": [],
      "potion": {
        "characteristic_sequence": 4,
        "ingredients": [],
        "formula_id": "formula_black_emperor_4"
      },
      "advancement_ritual": {
        "location_tags": [],
        "moon_phase": null,
        "sacrifices": [],
        "sigils": []
      },
      "madness_on_force": 0,
      "notes": ""
    },
    {
      "sequence": 3,
      "id": "black_emperor_3",
      "name": "Frenzied Mage",
      "name_i18n": "sequence.black_emperor.3",
      "tier": "saint",
      "concept": "",
      "stat_modifiers": {},
      "abilities": [],
      "acting_actions": [],
      "potion": {
        "characteristic_sequence": 3,
        "ingredients": [],
        "formula_id": "formula_black_emperor_3"
      },
      "advancement_ritual": {
        "location_tags": [],
        "moon_phase": null,
        "sacrifices": [],
        "sigils": []
      },
      "madness_on_force": 0,
      "notes": ""
    },
    {
      "sequence": 2,
      "id": "black_emperor_2",
      "name": "Duke of Entropy",
      "name_i18n": "sequence.black_emperor.2",
      "tier": "angel",
      "concept": "",
      "stat_modifiers": {},
      "abilities": [],
      "acting_actions": [],
      "potion": {
        "characteristic_sequence": 2,
        "ingredients": [],
        "formula_id": "formula_black_emperor_2"
      },
      "advancement_ritual": {
        "location_tags": [],
        "moon_phase": null,
        "sacrifices": [],
        "sigils": []
      },
      "madness_on_force": 0,
      "notes": ""
    },
    {
      "sequence": 1,
      "id": "black_emperor_1",
      "name": "Prince of Abolition",
      "name_i18n": "sequence.black_emperor.1",
      "tier": "angel",
      "concept": "",
      "stat_modifiers": {},
      "abilities": [],
      "acting_actions": [],
      "potion": {
        "characteristic_sequence": 1,
        "ingredients": [],
        "formula_id": "formula_black_emperor_1"
      },
      "advancement_ritual": {
        "location_tags": [],
        "moon_phase": null,
        "sacrifices": [],
        "sigils": []
      },
      "madness_on_force": 0,
      "notes": ""
    },
    {
      "sequence": 0,
      "id": "black_emperor_0",
      "name": "Black Emperor",
      "name_i18n": "sequence.black_emperor.0",
      "tier": "god",
      "concept": "",
      "stat_modifiers": {},
      "abilities": [],
      "acting_actions": [],
      "potion": {
        "characteristic_sequence": 0,
        "ingredients": [],
        "formula_id": "formula_black_emperor_0"
      },
      "advancement_ritual": {
        "location_tags": [],
        "moon_phase": null,
        "sacrifices": [],
        "sigils": []
      },
      "madness_on_force": 0,
      "notes": ""
    }
  ]
}
